category,name
Artificial Laurel Tree,"Pair Of Artificial Bay Laurel Trees – 4Ft High Tree With Real Wood Trunk And Natural Leaf Indoor Or Outdoor Decorative Replica Plant 120Cm（Green,2）"
Artificial Laurel Tree,Red Hot Plants PAIR of Artificial Bay Laurel Trees – 1.2m high tree with real wood trunk and natural leaf.
Artificial Laurel Tree,vidaXL Artificial Plant Laurel Tree with Pot Home Office Indoor Outdoor Authentic Realistic Faux Fake Flower Greenery Decoration Green 90cm
Artificial Laurel Tree,"Zebery Artificial Bay Tree, 4ft Laurel Tree Solid Wood Fabric Silk Flower Green Indoor and Outdoor General Simulation Tree"
Fake Banana Trees,"Artificial Banana Tree Leaves Tropical Plant Faux Leaf Fake Palm Frond Plants Greenery Flowers Silk Bird of Paradise Palm Plant for Indoor Outdoor House Office Modern Decoration (Banana leaf, 1 Pack)"
Fake Banana Trees,"artplants.de Artificial Banana tree AMARU, 6ft/180cm – Fake tree"
Fake Banana Trees,"artplants.de Faux Banana plant BAGHEERA, 6ft/180cm – Silk banana tree/Artificial banana plant"
Fake Banana Trees,DHTOMC Artificial Plants Artificial Banana Tree Plant With Pot 150 Cm Green For House Office Bathroom
Fake Banana Trees,"Geko Artificial Banana Tree 140cm Plant – Detailed Fake Plant, Plastic Plant, Rubber Plant, Fake Tree, Artificial Tree"
Fake Banana Trees,INMOZATA Artificial Banana Tree Tropical Plant Decorative Plants in Pot for Indoor Outdoor Garden 180cm
Fake Banana Trees,LAMF Artificial Plants Tropical Leaves Faux Banana Tree Fake Tropical Large Palm Tree Leaves Imitation Leaf for Home Kitchen Wedding Party Flowers Arrangement
Fake Banana Trees,"Leaf 80cm Stunning Artificial Plants/Trees, Light Banana"
Fake Banana Trees,vidaXL Artificial Banana Tree Plant with Pot 150cm Green Fake Lifelike Indoor
Fake Banana Trees,"xutu Plant 3.9Ft Fake Banana Tree, Artificial Bird of Paradise Plant 120cm for Indoor Outdoor, Large Potted Greenery Plants for Home, Office, Lobby Decor"
Fake Lemon Tree,AOIWE Simulation Potted Plant Artificial Lemon Tree In Ceramic Flower Pot Lemon Tree Artificial Plant Artificial Potted Plants Artificial Plant Decoration
Fake Lemon Tree,"Artificial Tree Simulation Lemon With Realistic Fruit With Woven Flower Basket Large Living Room Green Plant Potted Plant Bonsai Interior Decoration,150Cm"
Fake Lemon Tree,Artificial Zen Bonsai Tree Artificial Fruits Lemon Tree Simulated Lemon Bonsai Home Decoration Potted Plant Living Room Ornament Fake Pomegranate Tree Artificial Bonsai Tree ( Color : Small Yellow )
Fake Lemon Tree,Closer to Nature Artificial 3ft 3″ Lemon Tree – Artificial Silk Plant and Tree Range
Fake Dracaena Plant,"Dracaena Lemon Lime | houseplant | Height 70 cm | Pot 17 cm | Easy Maintenance (1, Without Pot Cover)"
Fake Lemon Tree,jinyi2016SHOP Artificial Potted Plants Artificial Lemon Tree Plant Artificial Plant Lemon Tree in Weave Pot Potted Fake Plants Flower Home Party Garden Decoration Faux Plants Decor
Fake Lemon Tree,LAMF Artificial Lemon Tree Plant Decor Fake Green Pot Plants Flowers Ornaments for Indoor & Outdoor Display Mini Potted Fake Plants Flower for Home Party Garden Decoration
Fake Lemon Tree,Lemon Tree (Four Seasons)
Fake Lemon Tree,Lemon Tree Indoor Plant | houseplant | Height 60cm | Pot 22cm | Living Room Ready Potted Citrus Lemon Plant
Fake Lemon Tree,Lemon Tree Indoor Plant | houseplant | Height 80cm | Pot 22cm | Living Room Ready Potted Citrus Lemon Plant
Fake Lemon Tree,Lemon tree Standard – 1 tree
Fake Lemon Tree,Simulation Potted Plant Artificial Fruits Lemon Tree Simulated Lemon Bonsai Home Decoration Potted Plant Living Room Ornament Fake Pomegranate Tree Artificial Plant Decoration ( Color : Lager Yellow )
Fake Lemon Tree,"xutu Plant 3.6ft Artificial Lemon Tree 43” Imitation Lemon Tree Fake Yellow Lemons Fruits Artificial Plant, for Home, Living Room, Decoration Indoor Outdoor (Size : 74cm)"
Fake Lemon Tree,ZPEE Simulation grass Artificial Lemon Tree Plant Artificial Plant Lemon Tree in Weave Pot Potted Fake Plants Flower Home Party Garden Decoration Artificial plant
Artificial Topiary Trees,2 x Artificial Topiary Boxwood Spiral Trees (5ft/150cm)
Artificial Cypress Tree,"35 Inch/2.95ft Artificial Topiary Spiral Cypress Trees Ceder Trees Boxwood Topiary Artificial outdoor Faux Topiary Spiral Cypress Trees Artificial Topiary Trees,Faux topiary Boxwood trees,Set of 2"
Fake Boxwood Trees,Auihiay 10 Bundles Artificial Boxwood Shrubs
Artificial Topiary Trees,Best Artificial 120cm 4ft Boxwood Double Twist Spiral Topiary Tree **UV Fade Protected**
Artificial Topiary Trees,Best Artificial 75cm Topiary Cone Boxwood Buxus Tree
Artificial Topiary Trees,Best Artificial Natural Look 3ft 90cm Boxwood Topiary Spiral Tree UV Fade Protected
Artificial Topiary Trees,Geko 1-Piece Large 90 cm Single Artificial UV Boxwood Topiary Tree
Fake Boxwood Trees,"GreenBrokers 2 x Premium Quality Artificial Boxwood Pyramid Trees in Square Planter (3ft/90cm), Black, 90cm"
Artificial Cedar Trees,momoplant 18 inch Artificial boxwood topiary tree Artificial Cedar Cypress tree Artificial cypress spiral topiary trees Artificial Tree，topiary trees artificial outdoor Cypress ball
Artificial Topiary Trees,"MyGift Artificial Boxwood Topiary Tree in Modern Gray Pulp Planter, Set of 2"
Artificial Topiary Trees,Outsunny Set of 2 Artificial Boxwood Ball Topiary Trees Potted Decorative Plant Outdoor and Indoor Décor (67cm)
Artificial Topiary Trees,Oypla Set of 2 Artificial Topiary Boxwood Spiral Trees 80cm Indoor Outdoor Decoration
Artificial Topiary Trees,Triple Ball Artificial Boxwood Topiary Trees 4ft/120cm – Best Quality (Pack of 2)
Fake Cherry Blossom Tree,"BCXGS Artificial Cherry Blossom Flowers for Home Wedding Party Garden Office Decoration Silk Plants, Big Tree Fake Vines Flowers"
Fake Cherry Blossom Tree,BCXGS Artificial Cherry Blossom Flowers Simulated Artificial Cherry Blossom Tree – for Indoor/Outdoor/Party/Restaurant/Mall Artificial Plant 1.5 m
Fake Cherry Blossom Tree,BCXGS Artificial Peach Blossom Trees Artificial Cherry Blossom Tree Silk Flower 5 Feet Tall 1.5M Artificial Cherry Blossom Trees Light Pink Indoor Outdoor Wedding Fake Vines Flowers (Size : 150cm)
Fake Cherry Blossom Tree,BCXGS Handmade Gorgeous Artificial Flower Pink Cherry Blossom Tree Fake Vines Flowers for Home Wedding Party Garden Office Christmas decoration
Fake Cherry Blossom Tree,"BCXGS Home Decor Artificial Flower Cherry Blossom, Big Tree Fake Vines Flowers Indoor Outdoor Wedding Silk Sakura"
Fake Cherry Blossom Tree,XHN Beautiful Artificial Flower Pink Large Simulation Cherry Blossom Tree for Wedding Party Indoor and Outdoor Home Decoration(3m)
Fake Cherry Blossom Tree,XMQW Handmade Gorgeous Artificial Flower White Cherry Blossom Tree Fake Vines Flowers Indoor Outdoor Home Party Wedding Home Decor
Fake Cherry Blossom Tree,YLLSQ Artificial Cherry Blossom Trees Pure White Cherry Blossom Tree Arch Pink Fake Sakura Flowers Indoor Outdoor Home (10FT/3m)
Fake Evergreen Trees,"Leaf 100cm Large Fox’s Aglaonema (Spotted Evergreen) Tree Artificial Plant, Green & Silver"
Fake Evergreen Trees,"Leaf Artificial Tree, Evergreen Ficus, 110cm"
Fake Evergreen Trees,Leaf Design UK 95cm Umbrella Tree Dark Green-Extra Large Artificial Evergreen Ficus Plant Black Plastic Pot
Fake Evergreen Trees,"momoplant Artificial Evergreen Indoor Plant, 110cm Realistically Shaped Leaves Houseplant with Black Pot for Home Office Decor"
Fake Evergreen Trees,"momoplant Artificial Evergreen Plant, 43inch/110cm Fake Indoor Tree for Home Office Decor with Pot"
Fake Evergreen Trees,"momoplant Artificial Indoor Plant Decor, 47inch/120cm Evergreen Taro Palm Tree for Home Office"
Fake Ficus Trees,"GreenBrokers Artificial Variegated Ficus Tree 4ft, Potted Plant"
Fake Ficus Trees,Homescapes 4 Feet Green Ficus Tree With Real Wood Stems and Lifelike Leaves Replica Artificial Plant
Artificial Fiddle Fig Leaf Tree,INMOZATA Artificial Ficus Tree Fiddle Fig Plant Decorative Plants in Pot for Indoor Outdoor Garden 120CM
Fake Ficus Trees,"Leaf 120cm Premium Artificial Twist Tree, Dark Bushy Ficus"
Fake Ficus Trees,"Leaf 140cm Realistic Artificial Japanese Fruticosa Ficus Tree, Green &amp Black"
Fake Ficus Trees,"Leaf Artificial Ficus Tree, White Edge Twist, 130cm"
Fake Evergreen Trees,"Leaf Artificial Tree, Evergreen Ficus, 110cm"
Fake Ficus Trees,"Leaf Design UK 90cm Artificial Ficus Tree/Plant-Large Bushy Shape Black Plastic Pot, Green Bushy Ficus"
Fake Evergreen Trees,Leaf Design UK 95cm Umbrella Tree Dark Green-Extra Large Artificial Evergreen Ficus Plant Black Plastic Pot
Fake Ficus Trees,OloreHome Artificial Ficus Tree Variegated 7ft / 210cm
Fake Ficus Trees,Oypla Artificial Ficus Tree Plant 120cm Indoor Outdoor Garden Decoration
Fake Bonsai Trees,14.1″ Artificial Bonsai Tree Fake Plant Japanese Bonsai Decoration Potted Faux Pine Plants Bonsai Tree for Indoor/Outdoor Home Office Hotel Décor
Fake Bonsai Trees,"Artificial Bonsai Tree Artificial Bonsai Welcoming Pine Tree Simulation Potted Plant Decorative Bonsai, Desk Display Fake Tree in Ceramic Pot for Home, Office, Shop Decorative Gifts Simulation Tree"
Fake Bonsai Trees,"Artificial Bonsai Tree, 50cm"
Fake Bonsai Trees,Artificial Bonsai Tree/Welcome Bonsai Simulation Welcoming Pine Artificial Tree Artificial Bonsai Green Plant Potted Plant Indoor New Chinese Style Living Room Coffee Table Decoration Ornaments Faux P
Fake Bonsai Trees,"Artificial Potted Plants Artificial Bonsai Pine Tree Fake Plants Room Decor for Bedroom Aesthetic and Home Farmhouse Bathroom Decor, Height 11 Inch（with Cleaning Brush） Artificial Tree"
Fake Bonsai Trees,"Artificial Potted Plants Artificial Bonsai Welcoming Pine Tree,15 Inches Simulation Potted Plant Decorative Bonsai, Office, Shop Decorative Gifts（with Cleaning Brush） Artificial Tree (Color : A)"
Fake Bonsai Trees,"artplants.de Artificial Bonsai pine SELENA in a planter, 19″/48cm – Plastic pine bonsai tree"
Fake Bonsai Trees,"artplants.de Artificial Bonsai Tree Pine in planter, 210 needles, 20″/50cm, outdoor – Silk Bonsai/Bonsai Replica"
Fake Bonsai Trees,Boxwood Bonsai in Pot Emulate Simulation Decorative Artificial Tree Fake Plants Ornaments Home Decor H 33cm
Fake Bonsai Trees,Carmona microphylla S-Shape | Bonsai incl. Decorative Pot | Little Bonsai Tree | Evergreen Carmona | Height 20-25cm | Pot Ø 15 x 8 cm
Fake Bonsai Trees,"Decoration Desktop,sculpture Artificial Bonsai Tree/Welcome Bonsai Light Artist Home Decoration Zen Decoration Artificial Welcome Pine Iron Bonsai Living Room Porch Club Artificial Plantation Fake"
Fake Bonsai Trees,Homescapes Oriental Bonsai Tree Artificial Plant in Decorative Black Ceramic Glossy Pot 70 cm Faux Chinese Tree for Indoor Decoration
Fake Bonsai Trees,JTSYUXN Bonsai Pine Tree Fake Potted Artificial Plant Decoration DIY Decorative Bonsai Not Faded No Watering for Office Restaurant Table Centerpieces Windowsill Decor (Color : Blue)
Fake Bonsai Trees,"KDMB Artificial Bonsai Pine Tree,11Inch Faux Potted Plant Desk Display Fake Tree Pot Ornaments, Japanese Cedar Bonsai Plant for Home, Office Decoration"
Fake Bonsai Trees,"KOET Artificial Bonsai Pine Tree,11Inch Faux Potted Plant Desk Display Fake Tree Pot Ornaments, Japanese Cedar Bonsai Plant for Home, Office Decoration"
Fake Bonsai Trees,"Leaf 45cm Artificial Bonsai Tree, Twisted Ficus Bosai"
Fake Bonsai Trees,Leaf LEAF-7518 50cm Artificial Pine Bonsai Tree
Fake Bonsai Trees,"liangzishop Artificial Potted Plants 10 Inches Artificial Bonsai Tree,Plastic Faux Plant Decoration, Potted Fake House Plants, for Zen Garden Décor Artificial Tree"
Fake Bonsai Trees,"liangzishop Artificial Potted Plants 11 Inches Artificial Bonsai Pine Tree，Realistic Fake Plant Decoration, Potted Artificial House Plants, for Desktop Display， Zen Garden Décor Artificial Tree"
Fake Bonsai Trees,liangzishop Artificial Potted Plants 13 Inches Artificial Bonsai Tree Potted Plant，Simulation Bonsai Pine Green Plant，Fake Plants for Desk Home Office Display Artificial Tree
Fake Bonsai Trees,liangzishop Artificial Potted Plants 15 Inches Artificial Bonsai Pine Tree， Faux Potted Plants House Plants，fake Tree for Office Living Room Entrance Decoration Bonsai Crafts Gift Artificial Tree
Fake Bonsai Trees,"liangzishop Artificial Potted Plants 18 Inches Artificial Bonsai Tree,Plastic Artificial Plant Decoration, Potted Artificial House Plants, for Home Office, Zen Garden Décor Artificial Tree"
Fake Bonsai Trees,"liangzishop Artificial Potted Plants 19 Inch Fake Plant Bonsai Tree, Artificial Plants Ceramic Potted Tree， Faux Bonsai Tree Decoration for Bathroom Farmhouse Indoor/Outdoor Artificial Tree"
Fake Bonsai Trees,"liangzishop Artificial Potted Plants 19 Inches Artificial Plants Bonsai Pine Tree,Silicone Simulation Green Plant Bonsai, Used in Corridors Front Desk Etc Artificial Tree"
Fake Bonsai Trees,liangzishop Artificial Potted Plants Artificial Tree Simulation Welcome Pine Bonsai，8 Inch Fake Green Plant Bonsai for Living Room Hotel Entrance Home Decoration Artificial Tree
Fake Bonsai Trees,Ligne Déco | Artificial Bonsai Tree in Oval Ceramic Pot Blue 249 Leaves | 41 cm | Artificial Green Plant | Japanese Zen Bonsai | Home Office Decoration
Fake Bonsai Trees,LOFAMI Artificial Plants Bonsai Tree Fake Bonsai Artificial Bonsai Tree Welcoming Pine Bonsai Decoration Stone Model House Porch Micro Landscape Green Plant Ceramic Pot Decoration Artificial Bonsai
Fake Bonsai Trees,"Nearly Natural 4966 Cedar Bonsai Artificial Tree, 15-Inch, Green"
Fake Bonsai Trees,"QTQZ 2018 Mini Artificial Bonsai Tree Plant Pine Trees Flower Potted Vase Wedding Not Faded No Watering Artificial Plant Home Decoration, 13.39″/34 cm, 30"
Fake Bonsai Trees,"QTQZ Artificial Bonsai Tree Plant for Office Home Decoration, 40cm Deco Living Room Green,Black"
Fake Bonsai Trees,"QTQZ flower Mini Artificial Bonsai Tree Indoor, Mini Bonsai Tree Kit Will Not Faded Doesn’t Need Watering Potted Perfect for Office, Home Or Shelf Decoration (Plastic Resin)-Green"
Fake Bonsai Trees,"QTQZ Mini Artificial Trees with Pot Guest-Greeting Pine Artificial Plants Simulation Potted Flowers Faux Green Grass Turf Bonsai Home Decoration Ornaments for Office Desk Table Decor, 13.39″/34 cm, 7"
Fake Bonsai Trees,"xilinshop Faux Plants Artificial Bonsai Welcoming Pine Tree Simulation Potted Plant Decorative Bonsai, Desk Display Fake Tree in Ceramic Pot for Home, Office, Shop Decorative Gifts Artificial Plants"
Fake Bonsai Trees,"xinxinchaoshi Artificial Plants Artificial Rhododendron Tree Faux Bonsai Tree Faux Potted Houseplant Pebbles, Green, Home Decoration Gifts Indoor House Plant (Color : B)"
Fake Bonsai Trees,"Yyqx Artificial Plants Artificial Bonsai Pine Tree Desk Display Fake Tree and Lucky Elephant Decorative Sculpture Realistic Faux Potted Plant for Home, Office Decoration Artificial House Plants"
Fake Bonsai Trees,"YYWJ Artificial Bonsai Tree, Fake Cedar Tree Potted Plant, Simulation Japanese Pine Bonsai Plant Ornament 26 / 39CM Height for Office Restaurant Home"
Fake Orange Tree,Closer to Nature Artificial 3ft 3″ Orange Tree – Artificial Silk Plant and Tree Range
Fake Orange Tree,Closer2Nature FT044OW Artificial 1ft 3” Mini Orange Tree
Fake Orange Tree,Garden Market Place Artificial Plants – 1.2M Tall Artificial Orange Tree With Pot
Fake Orange Tree,"Kumquat Tree | Orange Tree Plant | Fruit Tree | houseplant | Height 50cm | Pot 15cm | Potted Citrus Tree (50, Without Pot Cover)"
Fake Orange Tree,Mini Orange Tree 25cm – 1 Tree
Fake Orange Tree,Olive Grove 1.2M Tall Artificial Orange Tree With a 34cm Granite Effect Planter
Fake Olive Tree,4ft Premium Quality Artificial Olive Standard Tree (Set of 2)
Fake Olive Tree,Flore Office Artificial Giant Olive Tree (240 cm) Top of the Range Olive Tree
Fake Olive Tree,Flore Office Artificial Large Head Olive Tree (210 cm) Top of the Range Olive Tree
Fake Olive Tree,Flore Office Artificial Tree Olive Tree (350 cm) Top of the Range Olive Tree Artificial Trees
Fake Olive Tree,Flore Office Top of the Range Artificial Olive Tree Head (150 cm) Mediterraneen Artificial Trees
Fake Olive Tree,Flore Office Top of the Range Artificial Olive Tree Head (95 cm) Olive Tree
Fake Olive Tree,Hardy Standard Olive Trees (Pair)
Fake Olive Tree,"Leaf LEAF-7148 Artificial Olive Topiary Fruit Tree Black Plastic Pot Design UK, 90cm (3ft)"
Fake Olive Tree,"Leaf LEAF-7149 Artificial Olive Topiary Fruit Tree Black Plastic Pot-by Design UK, 120cm (4ft)"
Fake Olive Tree,MyWheelieBin Simulation Of Olive Tree Fake Tree Decoration Large Green Plant Fake Tree Living Room Floor Bonsai Indoor Potted Plant 1.3m olive tree (including pots)
Fake Olive Tree,Olea Europaea- Olive Trees – Half standards – Established Plants Approx 100 cm Tall
Fake Olive Tree,Olea Europeana | Olive Tree | Outdoor Fruit Tree | Height 90-100cm | Pot Ø 22cm
Fake Olive Tree,Olive ‘Olea Europa’ Tree | Hardy Ornamental Potted Patio Trees for Small Gardens | Bushy Olea Europaea Plant in Pots | 2-3ft (1 Tree)
Fake Bay Tree,Olive Grove Set of 2-1.6M Tall Artificial Bay Trees With Pots
Fake Olive Tree,Olive Tree (Olea Europaea) 1/2 Standard
Fake Olive Tree,Olive Tree Standard 90-100cm Tall in an 20cm Pot
Fake Olive Tree,Olive Tree | Olive Trees in pots | Indoor Plant & Outdoor Plant | Olea Europaea | Height 100 cm (3.3ft)
Fake Olive Tree,ZPEE Simulation grass Artificial Olive Tree in Decorative Container Faux Tree Plant Fake Olives Leaf Large Home Floor Artificial Green Plant Potted ，2.3-Feet Artificial plant (Color : A)
Fake Monstera Plant,AIVORIUY Artificial Palm Leaves with Stems Tropical Plant Large Faux Turtle Leaf Artificial Plants Monstera Leaves Safari Leaves for Home Hawaiian Luau Party Wedding Jungle Decorations Table Plant
Fake Palm Trees,Artificial Fan Palm Phoenix Tree Home Office Interior Decoration
Fake Monstera Plant,"Artificial Trees, 2 Set of 16 Inches Artificial Plants Faux Trees with Monstera and Palm Trees in Black Potted Plant for Home Office Indoor Outdoor Decoration, Monstera & Palm Trees, 2 Packs"
Fake Palm Trees,Best Artificial 150cm / 5ft Areca Palm Tree Tropical Office Conservatory Indoor Outdoor Garden Plant
Fake Palm Trees,Best Artificial Spider Finger Palm Tree Tropical Office Conservatory Indoor Outdoor Garden Plant … (3ft / 90cm)
Fake Palm Trees,Closer to Nature Artificial 5ft Areca Palm Tree – Artificial Silk Plant and Tree Range
Fake Palm Trees,Closer2Nature Artificial 6ft Finger Palm Tree – Portofino Planter Not Included
Fake Palm Trees,FloralStem 130 cm Artificial Phoenix Palm Plant Exotic Decor for Home & Office
Fake Palm Trees,HOMESCAPES Sago Palm Tree Artificial Cycas Plant Home Office Indoor Decorative Plant Green 75 cm (2.5 ft) with Black Pot
Fake Palm Trees,INMOZATA Artificial Areca Palm Tree Tropcial Plant Decorative Plants in Pot for Indoor Outdoor Garden 130cm
Fake Palm Trees,"Kentia Palm | Howea forsteriana | houseplant | Indoor Plant | Height 90-150 cm | Pot 19 cm | Living Room Ready Potted Plant (90 cm, Without Pot Cover)"
Fake Palm Trees,"Leaf LEAF-7018 Design UK Realistic Extra Large Artificial Princess Palm Tree (90cm Natural), Green"
Fake Palm Trees,"Leaf LEAF-7075 Design UK Realistic Extra Large Artificial Princess Palm Tree, 100cm Brown Trunk"
Fake Palm Trees,Leaf LEAF-7084 50cm Artificial Palm Tree Plant
Fake Palm Trees,"Leaf LEAF-7107 90cm Artificial Areca Palm Tree-Large, Green"
Fake Palm Trees,"Leaf LEAF-7152 Design UK Realistic Extra Large Artificial Princess Palm Tree, White Trunk, 100cm"
Fake Palm Trees,"momoplant Artificial Croton Palm Tree, 39inch/100cm Artificial Silk Plant for Home or Office with Pot"
Artificial Cheese Plant,"Outsunny 100cm/3.3FT Artificial Monstera Tree Decorative Cheese Plant 21 Leaves with Nursery Pot, Fake Tropical Palm Tree for Indoor Outdoor Décor"
Fake Palm Trees,Outsunny 120cm/4FT Artificial Palm Tree Decorative Plant w/ 19 Leaves Nursery Pot Fake Plastic Indoor Outdoor Greenery Home Office Décor
Fake Palm Trees,Outsunny 140cm/4.6FT Artificial Palm Plant Decorative Tree w/ 20 Leaves Nursery Pot Fake Plastic Indoor Outdoor Greenery Home Office Décor
Fake Palm Trees,Outsunny 150cm(5ft) Artificial Palm Tree Decorative Indoor Faux Green Plant w/Leaves Home Décor Tropical Potted Home Office
Fake Palm Trees,"Outsunny 60cm/2FT Artificial Palm Tree Decorative Plant 8 Leaves with Nursery Pot, Fake Tropical Tree for Indoor Outdoor Décor"
Artificial Cheese Plant,"Outsunny 85cm/2.8FT Artificial Monstera Tree Decorative Cheese Plant 13 Leaves with Nursery Pot, Fake Tropical Palm Tree for Indoor Outdoor Décor"
Fake Palm Trees,Outsunny Artificial Palm Tree
Fake Palm Trees,"Palm Tree | Indoor Potted Plant | Houseplant | Areca | Height 100-125 cm | Easy Maintenance (100cm, Without Pot Cover)"
Fake Palm Trees,Tradala 3’ Lush Artificial Tree in White Pot – Palm 90cm / 3ft Tall with Real Wood Trunk – For Home Living Room Indoors
Fake Palm Trees,Tradala 3’ Lush Artificial Tree Palm 90cm / 3ft Tall with Real Wood Trunk – For Home Living Room Indoors
Fake Palm Trees,Tradala 4’3” Lush Artificial Tree Large Palm 130cm / 4ft 3” Tall with Real Wood Trunk – For Home Living Room Indoors
Fake Pyramid Trees,2 x Artificial Boxwood Topiary Pyramid Trees in Black Square Planter (4ft/120cm)
Artificial Topiary Trees,2 x Artificial Trees 3ft Pyramid Cones – Indoor artificial trees – Topiary trees
Artificial Topiary Trees,60cm Artificial Topiary Boxwood Obelisks (Pair)
Fake Pyramid Trees,Artificial Tree: 3ft Pyramid Cone
Artificial Cedar Trees,"artplants.de Artificial Cedar LEONARDO, green, 6ft/180cm – Artificial cypress tree/Fake tree"
Fake Pyramid Trees,"artplants.de Faux Boxwood pyramid topiary TOM, decorative pot, 3ft/100cm – Artificial pyramid tree/Fake topiary"
Fake Bay Tree,FabFinds Artificial Topiary Tree Pyramid Bay Potted Tree Plant for Garden Patio Outdoor and Indoors – 70cm Tall
Fake Boxwood Trees,"GreenBrokers 2 x Premium Quality Artificial Boxwood Pyramid Trees in Square Planter (3ft/90cm), Black, 90cm"
Fake Pyramid Trees,INMOZATA Pair of Artificial Topiary Pyramid Cone Tree Boxwood Plant High for Garden Indoors Outdoor (120cm)
Fake Pyramid Trees,"The Fellie Replica Artificial Plant Pyramid Boxwood Tree 2 Pack, 4ft (120CM) Indoor Home Office Decorative Fake Plant"
Fake Pyramid Trees,Tradala 4’ Lush Artificial Pyramid Bay Tree 120cm / 4ft Tall with Real Wood Trunk – For Home Living Room Indoors
Fake Pyramid Trees,"UK-Gardens Artificial Plants – 5ft Pyramid Bay Tree in a Pot – Indoor Plant, House Plant or Office Plant"
Fake Pyramid Trees,Wyxy Pair of Artificial Topiary Pyramid Cone Tree Boxwood Plant High for Garden Indoors Outdoor (120cm)
Fake Pineapple Trees & Plants,Artificial Succulent Plant 7.8″ Porcelain Pot Pineapple Shape Home & Garden Decoration (Rose Gold)
Fake Pineapple Trees & Plants,Best Artificial 30cm x 15cm Large Realistic Pineapple Fruit
Fake Pineapple Trees & Plants,BLASCOOL Fake Plants Artificial Succulent Decor – Fake Pineapple Faux Decorative Plants in Port for Home Kitchen Bathroom bedroomby (Rosegold)
Fake Pineapple Trees & Plants,BUZZ Miniature Artificial Pineapple Plant/Succulent/Houseplant in White Pineapple Shape Ceramic Plant Pot with Pebble Detail – 12cm
Fake Pineapple Trees & Plants,"Cavis Artificial Potted Succulent Plants Set, Faux Succulents in Pots Home Decor (Gold)"
Fake Pineapple Trees & Plants,"cherrypop Potted Artificial Succulent Decoration, Fake Pineapple Plant for Home Office Tabletop Decoration (Orange)"
Fake Pineapple Trees & Plants,EliteKoopers 68cm Artificial Pineapple Tree For Home Office Outdoors Decoration Item
Fake Pineapple Trees & Plants,Fauge 4Pack Artificial Pineapple Grass Air Plants Fake Flowers Faux Flocking Tillandsia Bromeliads Home Garden Decor
Fake Pineapple Trees & Plants,"Geko Artificial Pineapple Tree 68cm, Green, Large, One Size"
Fake Pineapple Trees & Plants,HoitoDeals Artificial Pineapple Tree For Home Office Outdoors Decor Novelty Item
Fake Pineapple Trees & Plants,"Hopeful Artificial Fake Plants Pine needles pineapple No Fade High simulation Suitable for home decoration, exterior landscaping, bedroom, outdoor yard, wedding, Gift for women etc."
Fake Pineapple Trees & Plants,"Lvydec Potted Artificial Succulent Decoration, Fake Pineapple Plant for Home Office Tabletop Decoration (White)"
Fake Pineapple Trees & Plants,Melody Maison Artificial Succulent Plant in Pineapple Pot
Fake Pineapple Trees & Plants,"Midream Pineapple Plant Ornamental, Artificial Potted Succulent Plants Set Faux Succulents in Pots Home Decor with Leaves (Gold)"
Fake Pineapple Trees & Plants,Pineapple Shaped Novelty Artificial Succulent House Plant with Ceramic Gold Plant Pot
Fake Pineapple Trees & Plants,Resin Flower Pot Decor Pineapple-Shaped Resin Flower Pot Planters Home Decor Craft – Yellow
Artificial Cheese Plant,"Artificial 11 Leaves Monstera Deliciosa Plant 3.94ft/120cm Fake Tropical Palm Tree, Perfect Faux Swiss Cheese Plants in Pot for Indoor&Outdoor ,1 Pack"
Artificial Cheese Plant,Artificial Tree Home Plant Decor Artificial Monstera Deliciosa Plant Fake Tropical Palm Tree Perfect Faux Swiss Cheese Planter Pot for Home Garden Office Store Decoration Fake Decorative Plants House
Artificial Cheese Plant,"artplants.de Artificial Philodendron Monstera Deliciosa ARELA, green, 33″/85cm – Artificial cheese plant/Faux monstera plant"
Artificial Cheese Plant,"artplants.de Fake Philodendron Monstera Deliciosa LASO, 4ft/120cm – Artificial cheese plant/Faux monstera plant"
Artificial Cheese Plant,"artplants.de Fake Philodendron Selloum AWEO, 3ft/95cm – Artificial cheese plant/Faux monstera plant"
Artificial Cheese Plant,"artplants.de Fake philodendron selloum SILAS, 80cm – Artificial cheese plant/Faux monstera plant"
Artificial Cheese Plant,"artplants.de Plastic Split Philodendron seedling, 4 leaves, potted, 4ft/120cm – Cheese plant/Artificial philodendron"
Artificial Cheese Plant,"BESAMENATURE 30 Inch Artificial Monstera Deliciosa Plant, Faux Swiss Cheese Plant for Home Office Decoration"
