category,name
Artificial Cheese Plant,"Closer2Nature Artificial 4ft Swiss Cheese Plant, P105W"
Artificial Cheese Plant,Garden Market Place 1.2M Tall Artificial Cheese Plant (Monstera) Complete With 34cm Granite effect planter
Artificial Cheese Plant,Indoor 30-40cm Potted | Monstera Deliciosa Swiss Cheese Plant
Artificial Cheese Plant,Indoor Plant -House or Office Plant -Monstera deliciosa – Swiss Cheese Plant Approx 60cms Tall
Artificial Cheese Plant,"momoplant Artificial Monstera Deliciosa Plant, 47inch/120cm Fake Tropical Palm Tree, Set of 2 Faux Swiss Cheese Plants for Indoor Outdoor Decor"
Artificial Cheese Plant,Monstera Deliciosa | Swiss Cheese Indoor Plant | Air Purifying | Height 70 cm | Pot-Ø 21 cm
Artificial Cheese Plant,"Outsunny 100cm/3.3FT Artificial Monstera Tree Decorative Cheese Plant 21 Leaves with Nursery Pot, Fake Tropical Palm Tree for Indoor Outdoor Décor"
Artificial Cheese Plant,"Outsunny 85cm/2.8FT Artificial Monstera Tree Decorative Cheese Plant 13 Leaves with Nursery Pot, Fake Tropical Palm Tree for Indoor Outdoor Décor"
Artificial Cheese Plant,Swiss Cheese Plant (Monstera deliciosa) in 13/14cm Pot. 40-50cm Tall Approx.
Artificial Cheese Plant,"Swiss Cheese Plant Indoor Evergreen House Plant Monstera Plant for Home, Office & Conservatory with Large, Glossy Exotic Leaves, 1 x 11cm Pot by Thompson & Morgan"
Artificial Cheese Plant,URBNLIVING Artificial Plants in Pots 90cm Tropical Jungle Plants (Swiss Cheese Plant)
Artificial Cheese Plant,"whyshare 26cm Artificial Potted Cheeseplant Monstera, Variegated Ivy and Tropical Leaf Mini Plants Bedroom Outdoor Faux indoor plant set x3"
Artificial Cheese Plant,whyshare Faux Artificial Green Monstera Swiss Cheese Plant Split-Leaf Philodendron Home Office/Indoor and Outdoor in white Pot 36cm
Artificial Cheese Plant,"WhyShare Faux Artificial, Leaf Monstera Large Swiss Cheese Plant, Home office and Indoor/Outdoor Green in Cement Pot 50cm"
Artificial Cheese Plant,"whyshare Faux Artificial, Leaf Monstera Swiss Cheese Plant, Home office and Indoor/Outdoor Green in Cement Pot 33cm"
Artificial Cheese Plant,"YouGarden Monstera deliciosa (Swiss Cheese Plant) in 14cm Pot 50cm Tall Houseplant, Green"
Artificial Agapanthus Plants,"artplants.de Artificial agapanthus NASH, blue, 30″/75cm – Fake agapanthus"
Artificial Agapanthus Plants,"artplants.de Artificial agapanthus NASH, cream, 30″/75cm – Fake agapanthus"
Artificial Agapanthus Plants,"artplants.de Set 12 x Artificial Agapanthus MAILIN, cream, 28″/70cm, Ø 5.1″/13cm – Artificial flower/Silk flower"
Artificial Agapanthus Plants,"artplants.de Set 2 x Artificial Agapanthus INJALA in a root ball, 6 flowers, blue, 31″/80cm – 2 pieces Artificial flowering plant/Fake agapanthus"
Artificial Agapanthus Plants,"artplants.de Set 6 x Artificial flower Agapanthus GERARD, blue, 3ft/90cm – 6 pcs Fake agapanthus"
Artificial Agapanthus Plants,Emerald Artificial Agapanthus 75cm Blue Faux Lifelike Indoor Plant Greenery
Artificial Agapanthus Plants,Emerald Artificial Agapanthus 75cm Cream Faux Lifelike Indoor Plant Greenery
Fake Taro Trees,Geko 1-Piece Extra-Large 105 cm Artificial Taro Plant
Fake Taro Trees,"Geko Artificial Taro Tree 145cm, Green, Large, One Size"
Fake Taro Trees,"Geko Artificial Taro Tree with 3 Trunks 150cm, Green, Large, One Size"
Fake Evergreen Trees,"momoplant Artificial Indoor Plant Decor, 47inch/120cm Evergreen Taro Palm Tree for Home Office"
Fake Spiral Trees,2 x Artificial Topiary Boxwood Spiral Trees (3ft/90cm)
Artificial Topiary Trees,2 x Artificial Topiary Boxwood Spiral Trees (5ft/150cm)
Fake Spiral Trees,2.95 ft Artificial cypress spiral topiary trees Topiary Trees Artificial Plants Green Spiral Cypress Tree Fake Plant Swirl Topiaries decoration Indoor or Outdoor，35 Inch Spiral Tree-2 Pack
Artificial Cypress Tree,"35 Inch/2.95ft Artificial Topiary Spiral Cypress Trees Ceder Trees Boxwood Topiary Artificial outdoor Faux Topiary Spiral Cypress Trees Artificial Topiary Trees,Faux topiary Boxwood trees,Set of 2"
Fake Spiral Trees,"Artificial Buxus (Boxwood) Topiary Spiral Tree – Real Wood Trunk, suitable for Outdoor use."
Artificial Cypress Tree,Artificial Cypress Topiary Spiral Tree – 1.2m (4ft) – UV resistant – Indoor/Outdoor Use
Artificial Cypress Tree,Artificial Cypress Topiary Spiral Tree – 1.5m (5ft) – UV resistant – Indoor/Outdoor Use
Fake Spiral Trees,Artificial Spiral Boxwood Topiary Trees 3ft/96cm – Best Quality (Set of 2)
Fake Spiral Trees,"Artificial Topiary Boxwood Spiral Trees (4ft/120cm), Pack of 2"
Artificial Cedar Trees,Best Artificial 120cm 4ft Cedar Conifer Spiral Topiary Tree **UV Fade Protected**
Fake Plants,Best Artificial 2 (TM) 90cm 3ft Cedar Conifer Spiral Topiary Trees alt Boxwood Buxus **UV Fade Protected**
Fake Spiral Trees,Best Artificial 3ft 90cm Boxwood Buxus Topiary Spiral Tree **UV Fade Protected**
Artificial Cedar Trees,Best Artificial 5ft 150cm Cedar Double Twist Spiral Topiary Tree **UV Fade Protected**
Artificial Cedar Trees,Best Artificial 90cm 3ft Cedar Conifer Spiral Topiary Tree alt Boxwood Buxus **UV Fade Protected**
Artificial Topiary Trees,Best Artificial Natural Look 3ft 90cm Boxwood Topiary Spiral Tree UV Fade Protected
Artificial Cedar Trees,Best Artificial Pair of 120cm 4ft Cedar Conifer Spiral Topiary Trees **UV Fade Protected**
Artificial Cedar Trees,"GreenBrokers Artificial Spiral Cedar Conifer Trees 4ft/120cm-Best Quality (Set of 2), Green, 30x30x120 cm"
Artificial Cypress Tree,Home Pure Garden 3-Foot-Tall Artificial Cypress Spiral Topiary Indoor or Outdoor UV Protection Trees in Pot Office
Fake Spiral Trees,INMOZATA Pair of Artificial Topiary Swirl Trees Boxwood Spiral Trees Plant 4t/120cm High for Garden Indoors Outdoor
Fake Spiral Trees,"Leaf Design UK Artificial Boxwood Spiral Trees with Metal Tips, Mixed Materials, Green, 90cm"
Fake Spiral Trees,"Leaf LEAF-7164 Artificial Boxwood Tower Tree Topiary Spiral Twist Metal Top Design UK, 120cm (4Ft) Tall"
Fake Spiral Trees,"momoplant 2 Set Artificial Spiral Boxwood Topiary Trees, 3 Ft / 90cm Realistic Buxus for Outdoor and Indoor Decor with Black Pot"
Fake Spiral Trees,momoplant 35 Inch Spiral Topiary Artificial Outdoor Artificial Topiary Tree Faux Topiaries swirl Tree Indoor Boxwood Spiral Topiary Trees 2 Pack
Fake Spiral Trees,"momoplant 35 inches/2.95ft Artificial trees Artificial Boxwood Spiral Topiary Trees Boxwood Topiary Artificial outdoor faux topiary trees outdoor,set of 2pcs"
Artificial Cypress Tree,"momoplant Artificial Spiral Trees, 2 Set of 3 Ft / 90cm Topiary Cypress Plants for Outdoor and Indoor Decor with Black Pot"
Fake Spiral Trees,momoplant Set of 2 UV Artificial Milan Tree，Artificial Spiral Boxwood Topiary Tree，Pair of 80cm Faux Buxus Plant for Outdoor Indoor Decor
Fake Spiral Trees,OTZ 2 x Spiral Tree Artificial Topiary Swirl Tree (100cm)
Fake Spiral Trees,Outsunny Set of 2 Artificial Boxwood Spiral Topiary Trees Potted Decorative Plant Outdoor and Indoor Décor 112cm
Artificial Topiary Trees,Oypla Set of 2 Artificial Topiary Boxwood Spiral Trees 80cm Indoor Outdoor Decoration
Fake Spiral Trees,Pair of Best Artificial 5ft 150cm Cedar Conifer Spiral Topiary Trees **UV Fade Protected**
Fake Spiral Trees,"The Fellie Artificial Potted Plant Spiral Tree 2 Pack, 4ft (120CM) Home Office Decorative Fake Plant"
Artificial Cedar Trees,Warmiehomy Pair of Artificial Plants Cedar Spiral Topiary Tree Artificial Tree 90cm Artificial Plant for Ourdoor Indoor Conservatory Decoration
Artificial Hanging Plants,Adisputent 2 Pack Artificial Hanging Plant Ivy Fake Flower Garland Vine Greenery Green Leaves Wedding Home Wall Decoration Green dill
Artificial Hanging Plants,"Blulu Artificial Ivy Hanging Vine Plant Leaves Garland for Christmas Wedding Party Garden Wall Decoration, 2 Pack"
Artificial Hanging Plants,CCINEE 2 Pieces 35.4″ Artificial Ivy Hanging Vine Plant Leaves Garland for Christmas Wedding Party Garden Wall Decoration
Artificial Hanging Plants,"CQURE 24 Pack 168Ft Artificial Ivy Garland,Ivy Garland Fake vine UV Resistant Green Leaves Fake Plants Hanging Vine Plant for Wedding Party Garden Wall Decoration"
Artificial Ivy Plants,"MARTHA&IVAN Artificial Ivy –M&I Design 14 Pack 115Ft, Fake Ivy Garland Decorations,Fake Plants,Fake Vine,Vine Decoration for Wedding,Party, Garden, Home Decoration (14 Pack Ivy)"
Artificial Hanging Plants,"Mocoosy 2 Pack Artificial Hanging Plants with Baskets, Fake Hanging Ivy Vine Wall Hanging Plants Greenery for Home Garden Room Wedding Decorations"
Artificial Hanging Plants,SMALUCK 24 Pack 168 Ft Artificial Ivy Garland Fake Ivy Vine Hanging Plant for Christmas Decorations Wedding Garland Fake Foliage Flowers Home Kitchen Garden Office Wedding Wall Decor
Artificial Hanging Plants,SPTwj 2 Pack Artificial Ivy Vine Artificial Plants Fake Ivy Hanging Home garden Office Outdoor Indoor Decor Red
Artificial Hanging Plants,SPTwj 2 Pack Artificial Ivy Vine Artificial Plants Fake Ivy Hanging Home Office Outdoor Indoor Decor Total length of about 77 cm Purple
Artificial Hanging Plants,SPTwj 2 Pack Artificial Ivy Vine Artificial Plants Fake Ivy Hanging Home Office Outdoor Indoor Decor Total length of about 77 cm yellow
Artificial Hanging Plants,"Warmiehomy Artificial Plants Wisteria Ivy Vine Hanging Fake Flower Vine Greenery Garland for Wedding Party Home Wall Balcony Outdoor Summer Decoration, Hot Pink"
Artificial Hanging Plants,YGSAT 2 PCS Hanging Garland Vine Flower Trailing Bracket plant| Artificial Ivy|Artificial Flowers Fake Wisteria Office Decoration Home Decoration Party Decoration Wedding Decoration-Green
Artificial Trailing Plants,FUJIE 2 Pcs Artificial Ivy Vine Artificial Plants Fake Ivy Hanging Garland Trailing Bracket plant for Outdoor Indoor Hanging Basket Decor
Artificial Trailing Plants,Hawesome artificial Hanging Plant Ivy Vines Trailing Plant Ivy Garland Wall Leaves Greenery Garden Decoration 1 Set without basket
Artificial Trailing Plants,HUAESIN 2 Pcs Artificial Trailing Plants Face Trailing Ivy Plants Fake Silk Hanging Willow Leaves Ivy Vine Plastic Faux False Weeping Drooping Plants House Wedding Garden Wall In/Outdoor Decor
Artificial Trailing Plants,HUAESIN 2 Pcs Artificial Trailing Plants Fake Fern Trailing Plants Long Faux House Plants Platic Hanging Plants Kimberly Queen Boston Fern for Wall Basket Home Garden Hanging Decor 115cm
Artificial Trailing Plants,HUAESIN 3Pcs Artificial Trailing Plants Purple Fake Silk Hanging Plants Faux Hanging Ivy Vine Garland Plants for Home Bedroom Wedding Party Wall Balcony Outdoor Hanging Decor
Artificial Trailing Plants,JPGhaha 2 Pack Artificial Hanging Ferns Plant 83cm Plastic Persian Rattan Fake Trailing Hanging Plant Faux Hanging Boston Ferns Flowers Vine Outdoor Wall Indoor Hanging Baskets Wedding Garland Decor
Artificial Trailing Plants,KingYH 2 Pack Artificial Hanging Vines Plants Plastic Fake Trailing Weeping Ivy Vine Greenery Drooping Plant for Wall Indoor Outside Garden Wedding Hanging Pot Basket Decoration
Artificial Trailing Plants,KingYH 2 Pack Artificial Trailing Hanging Plants Green Leaves Ivy Faux Plastic Fake Hanging Garland Ivy Vine for Home Garden Wedding Wall Hanging Basket Decoration
Artificial Trailing Plants,MIHOUNION 2pcs Artificial Trailing Plants Fake Hanging Plants Plastic Faux Foliage Greenery House Plant for Indoor Outside Home Bedroom Garden Wedding Hanging Pot Basket Decor
Artificial Trailing Plants,MIHOUNION 2pcs Fake Trailing Climbing Plants Artificial Hanging Ferns Plant Plastic Hanging Greenery kimberly Queen Boston Fern for Wall Indoor Outside Hanging Basket Decor
Artificial Trailing Plants,"NIBESSER 2 Packs Hanging Plants Fake Artificial Ivy Vines Green, Artificial Hanging Vines Spring Leaf Drooping Trailing Weeping Plants, Artificial Vines for Wall Bedroom Indoor Outside Garden Wedding"
Artificial Trailing Plants,NUHUAA 2Pcs Artificial Hanging Plants Spring Fake Ivy Hanging Purple Plastic Fake Trailing Weeping Artificial Plant for Wall Indoor Outdoor Garden Wedding Hanging Decoration 75cm/29. 5Inch
Artificial Wisteria Plant,12PCS/Lot Artificial Flowers Fake Wisteria Vine Silk Flower for Wedding Decorations Home Garden Party Decor Simulation Flower 110CM/Piece (Purple)
Artificial Wisteria Plant,Adisputent Artificial Flowers Wisteria Vine Fake Flowers Hanging Plants Wall Home Basket Decor Pack of 2 Outdoor Balcony Basket Garden Party Wedding Christmas Decorations (yellow)
Artificial Wisteria Plant,Adisputent Artificial Wisteria Vine Fake Flowers Hanging Plant Wall Home Balcony Basket Decor Pack of 2 (Red)
Artificial Wisteria Plant,Closer2Nature Artificial 5ft Lilac Wisteria Tree – Portofino Planter Not Included
Artificial Wisteria Plant,"GreenBrokers Premium Artificial Lilac Wisteria Tree 150 cm Potted Plant, Purple"
Artificial Wisteria Plant,MARTHA&IVAN 14 PCS Artificial Wisteria Fake Wisteria Garland Faux Wisteria Artificial Wisteria Vine Garland (Purple 14 Pack)
Artificial Wisteria Plant,MJARTORIA 2 PCS Artificial Ivy Garland Fake Flowers Wisteria Hanging Vine Plants Drooping Plants Wall Hanging for Garden Home Hanging Basket Decoration Outdoor
Artificial Wisteria Plant,MJARTORIA 2pcs Artificial Wisteria Vine Artificial Plants Fake Flowers Hanging Plant Wall Home Balcony Basket Decor for Home Decor Indoor
Artificial Wisteria Plant,"New rui cheng Artificial Flower, Vine Ratta Hanging Garland Silk Wisteria Flowers Purple String 12 Pack Set 3.6 Feet Fake Flowers Green Leaves Plastic Plant String for Home Party Garden Wedding Decor"
Artificial Wisteria Plant,"New rui cheng Artificial Hanging Plants, Artificial Leaves White Wisteria Flower 12 Pack Fake Vine Hanging Plant Artificial Vine Plant Garland Green Leaves Fake Plastic Plant Garden Wedding Wall Decor"
Artificial Wisteria Plant,NORTHERN BROTHERS Flower Garland Fake Flowers Wisteria Artificial flowers For Decoration Outdoor Plants 4pcs
Artificial Wisteria Plant,Pauwer 24 Pieces Artificial Flowers Fake Wisteria Garland Hanging Wisteria Silk Flowers for Home Decoration Weddings Home Garden Party
Artificial Wisteria Plant,Souarts Artificial Wisteria Basket Artificial Vine Flowers for Hanging Basket Fake Hanging Flowers Simulation Flowers Vine Wedding Bouquet Home Decoration
Artificial Wisteria Plant,"Tifuly 12 Pcs Artificial Wisteria Vines, 3.6 FT Fake Wisterias with 3 Branches, Long Wall Garland Silk Hanging Flower for Home Party Wedding Ceiling Decoration(12Pcs,Off-White)"
Artificial Wisteria Plant,VINFUTUR 5 x 7 FT Artificial Wisteria Vine Garland Plants Fake Flowers Hanging Garland for Home Party Garden Wedding Decoration (Purple)
Artificial Wisteria Plant,XHXSTORE 12PCS 3.6 Feet Wisteria Artificial Flowers Hanging Wisteria Garland Fake Wisteria Vine Ratta Faux Silk Wisteria Ivy Hanging Flower Wedding Garden Home Party Hotel Decor White
Fake Caladium Plant,Artificial Caladium Plant with Pot 70 cm Green and Red
Fake Caladium Plant,"Artificielles.com Artificial Caladium in Pot, H 40 cm D 50 cm, Large Fabric Leaves"
Fake Caladium Plant,"Nearly Natural Caladium Artificial Plant in Black Glossy Planter, Green"
Fake Caladium Plant,Tidyard Artificial Plant Caladium Tree with Pot Outdoor&Indoors Plant Bonsai Display in Home 70 cm Green and Red
Fake Caladium Plant,vidaXL Artificial Caladium Plant with Pot 70cm Green and Red Lifelike Fake
Fake Aloe Vera Plants,Aloe Vera houseplant Healing Succulent
Fake Aloe Vera Plants,"Aloe Vera Plant | Pure Succulent Plant | with Healing Aloe Vera Gel | Height 25-30cm | Pot Size Ø 10,5cm"
Fake Aloe Vera Plants,"artplants.de Artificial Plants Set – Alejandra with Aloe, Yucca, Echeveria, Crassula Artificial Cactus in Ceramic Pot, 18cm"
Fake Aloe Vera Plants,Best Artificial 60cm 2ft Aloe Vera Plant Indoor Outdoor Tropical Office Conservatory Garden Tree
Fake Aloe Vera Plants,"Clas Ohlson ® Artificial Aloe Vera Bonsai in a Pot, 30 cm High, 14 cm Diameter, Fake Indoor Plant with Pot"
Fake Aloe Vera Plants,"Fantastic Delightful Aloe Vera Plant Excellent healing benefit – Aloe Vera Gel – Next day delivery option – Aloe Vera, Aloe vera plants, Aloe plant, Aloe Vera plant, Healing, Aloe Vera Gel, evergreen, easy care, treating burns cuts rashes, gift, plant gif"
Fake Aloe Vera Plants,"Flair Flower Succulents in Wooden Arrangement Fake Cactus Artificial Pot Green Plant Aloe Vera Flower Table Decoration, ca. 11x8x13 cm"
Fake Aloe Vera Plants,"Homescapes Lifelike Artificial Succulent Purple & Green Aloe Vera Plant in Round Decorative Black Pot, 21cm Tall for Indoor Use"
Fake Aloe Vera Plants,"Homescapes Lifelike Large Artificial Succulent Potted Aloe Vera Plant in Round Black Plastic Pot, 45cm Tall Lifelike Faux Cactus for Indoor Decoration"
Fake Aloe Vera Plants,"Homescapes Lifelike Small Artificial Succulent Potted Aloe Vera Plant in Round Black Plastic Pot, 30cm Tall Lifelike Faux Cactus for Indoor Decoration"
Fake Aloe Vera Plants,"momoplant 23 inch / 1.9 ft Artificial Succulent Fake Aloe for Home Office Decor,Faux Succulent Plant with Black Plastic Planter,Artificial tree"
Fake Aloe Vera Plants,Palmtree Home Decorative Owl with Artificial Succulent Aloe Vera 28x14centimeter. Realistic Fake Plastic Plant with Impressive Detail in Fancy Pot Requires No Care. Perfect for Home and Office
Fake Aloe Vera Plants,The Recipe Miniature Aloe Vera in Glass Pot
Fake Aloe Vera Plants,"Wrenbury Artificial Aloe Vera in Geometric Plant Pot, 30cm | Fake Aloe Vera in Geometric Cement Planter | Artificial Plant Faux Succulent Fake Plant | Fake Aloe Vera Plant Artificial Indoor Plant"
Fake Aloe Vera Plants,"Wrenbury Artificial Aloe Vera Plant in White Plant Pot, 30cm | Reversible Stand | Luxury Artificial Plant Fake Plants | Decorative Home Decor Indoor Succulent Plant Pot"
Fake Aloe Vera Plants,WSG Aloe Vera Artificial Plant Tree 38 cm Grey Pot Decoration Flower
Fake Agave Plants,27″ H Sansevieria Snake Plant – artificial agave – green color– with pot – from MOMO plant
Fake Agave Plants,Artificial flower 1 Pcs Fake Desert Plants Artificial Flower Sansevieria Simulation Succulent Agave Plant Home Office Shop Garden Decor (random Delivery)
Fake Agave Plants,Artificial Plants Small Sansevieria Snake Plant with Black Plastic Planter Greenery Perfect Faux Agave Fake Plants in Pot for Home Office Indoor and Outdoo Décor (13.4″ Green/ 7 Leaves)
Fake Agave Plants,"artplants.de Set 2 x Fake agave furcraea gigantea KNOX, crossdoor, green, 3ft/100cm – Artificial agave/Silk plant"
Fake Agave Plants,Beebel Artificial Snake Plant 22″ Fake Sansevieria Potted Plants Plastic Greenery Perfect Faux Agave Plant for Home Garden Office Store Decoration
Fake Agave Plants,"Bird Fiy Artificial Snake Plant Faux Agave Fake Sansevieria Artificial Potted Plants for Indoor and Outdoor Home Office Decor (Green, 16)"
Fake Agave Plants,Flore Office Agave FURCRAEA 80 Artificial Agave 80 cm High-Quality Outdoor Artificial Plants
Fake Agave Plants,Flore Office Furcraea Artificial Agave (110 cm) Top of the Range Agave Outdoor Artificial Plants
Fake Agave Plants,"HOMESCAPES Green Agave Americana Artificial Succulent Plant with Brown Pot, 60 cm (24″)"
Fake Agave Plants,"Homescapes Large Artificial Agave Tree 100 cm Tall Faux Succulent Cactus Tree Realistic Green Leaves Potted in White Ceramic Square Planter with Faux Stones for Home, Office or Party Decoration"
Fake Agave Plants,Kaemingk Artificial Agave Green 55cm – Potted Plant
Fake Agave Plants,"momoplant 27″ Artificial Agave Sansevieria Plants with 22 leaves, Green Color with Pot for Indoor Outdoor Decor"
Fake Agave Plants,"momoplant Artificial Plant Succulent Spiked Agave, 46cm Table Plant for Indoor Home Office Decor with 17 Green Leaves"
Fake Agave Plants,"Nearly Natural 6565 Agave Decorative Silk Plant, Green,25x25x25"
Fake Agave Plants,"Nearly Natural Agave with Black Planter Artificial Plant, Green"
Fake Anthurium Plant,"20Pcs Artificial Anthurium Flowers Real Touch Fake Flower for Home Decor Floral Arrangements Bouquets (Red,Sunset red)"
Fake Anthurium Plant,"Artificial Calla Anthurium Plant Potted,Fake Plant Bonsai Artificial FlowerLily Faux Potted Plant with Black Pot for Home, Office, Indoor and Outdoor Occasions Decor (Color : Red)"
Fake Anthurium Plant,Artificial Plants Artificial Anthurium Plant With Pot 45 Cm Home Office Decorations
Fake Anthurium Plant,"artplants.de Artificial Anthurium with 3 blooms, 25 leaves, 31″/80cm – Plastic flower anthurium/Artificial plant"
Fake Anthurium Plant,"artplants.de Fake anthurium LIOSA on spike, red, 31″/80cm, 3.1″-4″/8x10cm – Artificial flowers/Plastic anthurium"
Fake Anthurium Plant,Bediffer Plastic Artificial Plant Fake Red Anthurium Flowers Bouquet For Wedding Home Garden Decor
Fake Anthurium Plant,E-Greetshopping Artificial Anthurium Plant with Pot 90 cm Red and Yellow
Fake Anthurium Plant,"Flair Flower anthurium Pot anthurie Flamingo Exotic Blum red Plastic Plants Made of Textile Artificial Decorative Flowers, 42x20x20 cm"
Fake Anthurium Plant,Flore Office Artificial Anthurium 2 Flowers (45 cm) Top of the Range Anthurium Tropical Artificial Plants
Fake Anthurium Plant,MARJON Flowers Anthurium Red Flamingo Flower Artificial Fake Outdoor Plant Bushes Silk Floral Arrangements Home Kitchen Bedroom Christmas Decor Pack of 2
Fake Anthurium Plant,"Nearly Natural 24” Mixed Anthurium (Set of 2) Artificial Plant, Red"
Fake Anthurium Plant,"Nearly Natural 6668 Anthurium with Fluted Glass Bowl Decorative Silk Plant, Red,6.75″ x 6.75″ x 22.5″"
Fake Anthurium Plant,Nearly Natural Anthurium Artificial Terracotta Planter Silk Plants Red
Fake Anthurium Plant,"Niunion Bouquet, Plastic Artificial Plant Fake Red Anthurium Flowers Bouquet Wedding Home Garden Decor"
Fake Anthurium Plant,SKM Artificial Anthurium Plant with Pot 90 cm Red and Yellow
Fake Anthurium Plant,TOPSALE 4 Bunches Artificial Fake Flowers Faux Anthurium Plants Plastic Shrubs Bushes Greenery Indoor Outside Hanging Planter Home Decorations
Fake Anthurium Plant,vidaXL Artificial Anthurium Plant with Pot 90cm Red and Yellow Realistic Fake
Fake Anthurium Plant,ZPEE Simulation grass Faux Plants Artificial Tropical Anthurium Lily Flowers with Ceramic Flowerpot for Home Living Room Office Lucky Decoration Decoration Artificial plant
