category,name
Fake Bush,5 Bunches Realistic Artificial Plants
Fake Boxwood Trees,Auihiay 10 Bundles Artificial Boxwood Shrubs
Fake Outdoor Plants,Clas Ohlson Artificial Grass in a Pot
Fake Bush,Huaesin 4 Pieces Artificial Faux Plants
Fake Bush,Leixi 6pcs Artificial Plants
Fake Outdoor Plants,Lvcky 4 Bouquets Realistic Artificial Plastic Plants
Fake Outdoor Plants,Set of 6 Artificial Succulent Plants
Fake Outdoor Plants,Topcloud 3 Pack Mini Potted Artificial Plants
Fake Fern Plant,4 PCS Artificial Boston Fern Branches Fern Shrubs Leaf Spray Faux Greenery Artificial Plant for Home Garden Wedding Decoration Floral Arrangement
Fake Fern Plant,Artificial Boston Fern Faux Moss Coated Fern Plants Shrubs Fake Fern Leaves Persian Grass Simulation Fake Bushes for Indoor Home Garden Table Centerpieces Arrangements Decoration 30″ Long 3 PCS
Fake Fern Plant,Artificial Boston Fern Plants Shrubs Greenery Fake Fern Leaves Persian Grass Simulation Fake Bushes for Indoor Home Garden Table Centerpieces Arrangements Decoration 30″ Long 3 PCS
Fake Fern Plant,"BELLE VOUS Plastic Artificial Faux Hanging Boston Fern Plants (6 Pack) – Outdoor/Indoor Fake Greenery Ferns for Home, Garden, Vine Wall Basket, Bushes/Shrubs, Wedding Garland and Office Decor"
Fake Fern Plant,"Bestomrogh Artificial Hanging Plants, 2 PCS Fake Plastic Greenery Boston Fern Plant Vine, Ivy Leaves Garland for Indoor Outside Home Office Cafe Wedding Wall Decor"
Fake Fern Plant,DXLing 2 Pieces 80cm Fake Ferns Plants Artificial Ivy Garland Fake Boston Ferns Persian Rattan Artificial Hanging Plants Faux Plants Artificial Hanging Vines Plants for Wall Wedding Hanging Decoration
Fake Fern Plant,"Fycooler Faux Boston Ferns,Artificial Plants Vines Hanging Leaves Artificial Greenery Garland/Wreath 190cm in Length for Wedding Backdrop Arch Wall Decorations Studio Garden Home Décor"
Fake Bush,Huaesin 4 Pieces Artificial Faux Plants
Fake Fern Plant,JaneYi 2 Piece Artificial Boston Fern Plastic Plant Vine Foliage Fake Weeping Willow Ivy Artificial Hanging Ferns Plant Greenery Leaf for Indoor Outside Home Office Cafe Wall Garden Trellis Decor
Fake Fern Plant,JaneYi 6 Pieces Artificial Boston Fern Plant Artificial Phoenix Grass Fake Plastic Greenery Shrub Floral Arrangement Filler Leaf for DIY Indoor Outside Home Office Cafe Kitchen Balcony Garden Decor
Fake Fern Plant,"Leaf LEAF-7050 Artificial Bird’s Nest Fern Plant Black Plastic Pot, 60cm"
Fake Fern Plant,LumenTY 6 Pcs Artificial Fern Bush Plants Shrubs Greenery Artificial plant Faux Plastic Green Plant Decoration for Indoor and Outdoor Home Dining Table Garden Office Balcony Wedding Party Decoration
Fake Sansevieria Plant,"16″ Artificial Snake Plant Faux Agave Fake Sansevieria Artificial Potted Plants for Indoor and Outdoor Home Office Decor (Yellow, 16)"
Fake Agave Plants,27″ H Sansevieria Snake Plant – artificial agave – green color– with pot – from MOMO plant
Fake Agave Plants,Artificial flower 1 Pcs Fake Desert Plants Artificial Flower Sansevieria Simulation Succulent Agave Plant Home Office Shop Garden Decor (random Delivery)
Fake Sansevieria Plant,Artificial Plants Sansevieria Snake Plant with Black Plastic Planter Greenery Perfect Faux Agave Fake Plants in Pot for Home Office Indoor and Outdoo Décor (13.4″ / 7 Leaves)
Fake Agave Plants,Artificial Plants Small Sansevieria Snake Plant with Black Plastic Planter Greenery Perfect Faux Agave Fake Plants in Pot for Home Office Indoor and Outdoo Décor (13.4″ Green/ 7 Leaves)
Fake Sansevieria Plant,Artificial Sansevieria Snake Plant / Mother-in-laws Tongue – 57cm Tall
Fake Sansevieria Plant,Artificial Snake Plants 30″ Faux Agave Fake Sansevieria Artificial Silk Plant for Home Garden Office Store Decoration 4 Pcs (Yellow)
Fake Agave Plants,Beebel Artificial Snake Plant 22″ Fake Sansevieria Potted Plants Plastic Greenery Perfect Faux Agave Plant for Home Garden Office Store Decoration
Fake Agave Plants,"Bird Fiy Artificial Snake Plant Faux Agave Fake Sansevieria Artificial Potted Plants for Indoor and Outdoor Home Office Decor (Green, 16)"
Fake Sansevieria Plant,"Briful Artificial Snake Plant 16″/40.6CM Fake Sansevieria Faux Plants in White Ceramic Pot, Perfect for Indoor Outdoor Home Office Garden Modern Desk Decoration"
Fake Sansevieria Plant,"Clas Ohlson ® Artificial ‘Sansevieria Laurentii’ Mother-In-Laws Tongue, Yellow Green Fake Indoor Plant with Pot 60 cm"
Fake Sansevieria Plant,E-Greetshopping Artificial Yucca Plant with Pot 90 cm Green
Fake Sansevieria Plant,FloralStem Artificial Snake Sansevieria Plant Home Office Interior Decoration
Fake Sansevieria Plant,"Fycooler Artificial Plants Sansevieria,40cm Faux Snakeplant Sansevieria Laurentii Plant, Mother in Laws Tongue Plant Fake Agave Snake Plant Indoor Greenery Home Office Décor Potted Sansevieria Plant"
Fake Fern Plant,Milisten 4pcs Boston Fern Artificial Plants Fake Vines Hanging Ivy Decor Plastic Greenery for Wall Indoor Outdoor Wedding Garland Decor Yellow Green
Fake Fern Plant,MZMing 6 Bundles Realistic Artificial Plant Bouquets Plastic Shrubs and Greenery Bushes Fake Fern Grass Floral Arrangement Filler for Indoor Outdoor Home Office Kitchen Garden Balcony Table Decoration
Fake Fern Plant,SFTlite Artificial Shrub 6 Bundle Boston Fern Artificial Plant-Fake Shrub Leaves Simulation Greenery Bushe Floral Arrangement Filler-Ideal for Home Garden Office Decoration Party Wedding Shows
Fake Fern Plant,Silk Giant Boston Fern Bush – Green Artificial Plant
Fake Fern Plant,XHXSTORE 2 Pack Artificial Hanging Vines Plants Boston Fern Leaves Plastic Gypsophila Flowers Fake Ivy Vine Trailing Weeping Greenery Drooping Plant Garland for Wall Indoor Outdoor Basket Decoration
Fake Fern Plant,XHXSTORE 2 Pcs Artificial Fern Plants Fake Fern Indoor Outdoor Hanging Plastic Plants Faux Shrubs Greenery Bushes Big Boston Fern for Home Garden Verandah Wedding Hanging Basket Decor 48cm
Fake Fern Plant,XHXSTORE 2Pcs Artificial Plants Plastic Greenery Shrub Bushes Fuax Boston Fern Fake Persian Grass Fern Plant Arrangement for Indoor Outdoor Garden Wedding Office Home Table Decoration
Fake Bush,YGSAT 4 Pcs Persian Grass Fern|Artificial Bushes| Artificial Fern Grass Plastic green Plant|Fake Flower Plants – Ideal for Indoor Outside Home Garden Office Table Verandah Decoration Party Wedding
Fake Sansevieria Plant,"Leaf Artificial Tropical Snake Plant, 50cm Sansevieria"
Fake Sansevieria Plant,"Leaf LEAF-7087 Design UK Artificial Sansevieria Yellow Green Indoor Snake Plant, 55cm"
Fake Sansevieria Plant,"Leaf LEAF-7100 Design UK Artificial Sansevieria Yellow Green Indoor Snake Plant, 90cm"
Fake Sansevieria Plant,"Leaf LEAF-7537 70cm Artificial Plant, Moonshine Sansevieria"
Fake Agave Plants,"momoplant 27″ Artificial Agave Sansevieria Plants with 22 leaves, Green Color with Pot for Indoor Outdoor Decor"
Fake Dracaena Plant,"momoplant Artificial snake stripe Plant Faux Agave Fake Sansevieria Dracaena Potted Plants for Indoor&Outdoor Office Home room Decor 26″inchs 65CM (25.6“L * 13.7W Inchs, Green)"
Fake Sansevieria Plant,Nearly Natural 33” Sansevieria Artificial Silk Plants Green
Fake Sansevieria Plant,"Royal Imports Artificial Sansevieria Leaf Plant, Life-Like Snake Plant Faux Mother-in-Law Tongue Tree, Dark Green in Decorative Planter – 36″ Tall"
Fake Sansevieria Plant,"Sansevieria Plants 26″ Artificial Snake Plants Faux Green Plants Fake Indoor Floor Plants,Mother-in-law’s Tongue in Unbreakable Pot for Home Office 1 Pack"
Fake Sansevieria Plant,vidaXL Artificial Sansevieria Plant with Pot 65cm Green Indoor Lifelike Fake
Fake Eucalyptus Plant,"10 pcs 30cm Artificial Eucalyptus Branches Plants Silver Dollar Leaves Spray Greenery Bushes Fake Seeded Stem for Tables Decoration, Jungle Theme Party, Wedding Party Floral Arrangement Whaline"
Fake Eucalyptus Plant,3 Bundles Artificial Silver Dollar Eucalyptus Leaf Eucalyptus Leaf Sprays Realistic Artificial Eucalyptus Leaf 50 cm(20”) (white)
Fake Eucalyptus Plant,3 Pack Mini Potted Artificial Plants Faux Fake Greenery Eucalyptus Rosemary Plants for Home Office Table Desk Shower Kitchen Shelf Bedroom Bathroom Decoration Indoor Outdoor Decor
Fake Eucalyptus Plant,"3 Sets Decorative Artificial Plants,Green Plants Indoor Real Boom，Outdoors Large Potted，Eucalyptus,Rosemary and Gypsophila for Living Room Garden Decoration Bathroom,Bedroom,Kitchen,Office Desk PlantA"
Fake Eucalyptus Plant,"4 Pack Small Potted Artificial Plants, Faux Succulent Plants Gypsophila Eucalyptus Plant Pot for Office Desk, Home Bathroom Garden Indoor Decoration"
Fake Eucalyptus Plant,"Briful Mini Potted Artificial Plant Faux Flocked Eucalyptus Boxwood Rosemary Plants Small Houseplants Fake Greenery Room Decor for Table Desk Kitchen Shelf Bedroom Decoration, Set of 2"
Fake Eucalyptus Plant,Cekene 3 Pack Mini Potted Artificial Plants Fake Small Eucalyptus Greenery Plastic Faux Plants in Pots 9.5″ for Home Tabletop Office Farmhouse Bathroom Kitchen Indoor Outdoor Decor
Fake Eucalyptus Plant,Floralsecret 3 Pack Mini Artificial Potted Plants Faux Eucalyptus Rosemary Fern Greenery in Pots for Home Office Desk Room Decoration
Fake Eucalyptus Plant,"GDORUN 4 mini Potted Fake plants,Faux Succulents and Artificial Eucalyptus Plants Faux Eucalyptus in Pot Indoor for Home Tabletop Office Bathroom Kitchen Decoration (4Pot-B Fairy)"
Fake Eucalyptus Plant,Homcomodar 3 Pack Artificial Potted Plants Faux Eucalyptus Greenery in Pots Decorative Plant for Tabletop Décor
Fake Eucalyptus Plant,"HOMEFUN Fake Desk Plants Faux Potted Plants Eucalyptus Artificial Flowers Artificial Lavender Plant for House Office Bathroom Kitchen Bedroom, 2 Pack"
Fake Eucalyptus Plant,Kitzini Mini Potted Plants Artificial Flocked Eucalyptus Boxwood Rosemary Greenery in Pots Faux Potted Herbs Small Houseplants 8.8″-10″ Tall for Indoor Greenery Tabletop Décor Centerpiece 3 Pack
Fake Eucalyptus Plant,MELAJIA Faux Eucalyptus Branches 6 Pcs Artificial Greenery Stems Eucalyptus Silver Dollar Stems Silk Green Leaves Plant Garland for Home Party Wedding Decoration (24.8” Tall)
Fake Eucalyptus Plant,"New rui cheng Artificial Plant, Mini Plastic Plants Small Fake Plant Real Eucalyptus Rosemary Gypsophila 3pack Set with Pot Indoor Green Bonsai for Home Bathroom Kitchen Office Desk Garden Decoration"
Fake Eucalyptus Plant,"OFFIDIX Mini Plastic Eucalyptus Artificial Plants with Vase for Office desk, home and friends’ gift Fake Plant with Plastic Pots for Home Decoration (White)"
Fake Eucalyptus Plant,OFFIDIX Potted Artificial Plants Faux Plastic Plants with Pots ini Plastic Eucalyptus Plants for Home Office Decoration
Fake Eucalyptus Plant,"Tifuly 4 Pcs Artificial Silver Dollar Eucalyptus Leaves, 25.6” Silk Greenery Foliage Plants for Home Office Party Wedding Bouquet Decor, DIY Floral Arrangements, Centerpieces(Spray Green)"
Fake Eucalyptus Plant,VGIA 6 Pcs Artificial Greenery Stems Eucalyptus Leaf Spray in Green Fake Greenery for Home Office Wedding Decor
Fake Orchid Plant,15″ Artificial Phalaenopsis Flowers Arrangement Artificial Orchid Bonsai in Silver Pot Fake Flowers Silk Orchid Flower for Table Centerpieces Living Room Home Décor
Fake Orchid Plant,17″ Artificial Orchid Phalaenopsis Flowers Decorative Orchid Bonsai Fake Flowers Silk Orchid Flower with Silver Ceramic Pot for Table Centerpieces Living Room Home Décor
Fake Orchid Plant,Artificial Orange Orchid Flowers Fake Flower Bonsai with Square Basin Artificial Orchids Plant Arrangement Party Home Decor
Fake Orchid Plant,Artificial Orchid Plant Fake White Orchid Flower Real Touch Phalaenopsis Silk Orchids With Ceramic Pot Potted For Table Decorations Bedroom Bathroom Living room Indoor Decor
Fake Orchid Plant,Artificial Orchid White Orchid Plant Silk Flowers Real Touch Fake Orchid Artificial Flowers Bonsai With Silver Ceramic Vase Artificial Potted Plant For Home Bedroom Kitchen Bathroom Table Decoration
Fake Orchid Plant,Asvert Phalaenopsis Artificial Flower Orchid Bonsai with Ceramic Vase Wedding Party Home Centerpiece Decor (Pink)
Fake Orchid Plant,"BLOOM Artificial Double Phalaenopsis Orchid – Artificial Flowers, Silk Flowers, Faux Flowers That Look Real, Perfect For Mothers Day Flowers, Artificial Foliage in Glass Vase"
Fake Orchid Plant,"Briful Artificial Flower Orchid Flowers Plant Silk Phalaenopsis in Silver Ceramic Pot for Wedding Dinning Table Centerpiece Home Decor, Pink Lifelike Fake Flower"
Fake Orchid Plant,FagusHome 32 Inches Artificial Phalaenopsis Flowers 4 Pcs with 2 bundles Leaves Artificial Orchid Flowers Stem Plants for Home Décor (White)
Fake Orchid Plant,Famibay Artificial Orchid Plant in Pot White Phalaenopsis Flowers Fresh Real Touch Orchid Flowers for Home Decoration
Fake Orchid Plant,Famibay Artificial Phalaenopsis Orchid flowers Real Touch 11 Heads White Butterfly Orchid Flowers for Home Decoration Pack of 3 (White)
Fake Ficus Trees,Homescapes 4 Feet Green Ficus Tree With Real Wood Stems and Lifelike Leaves Replica Artificial Plant
Fake Orchid Plant,HOMESCAPES Cerise Purple Orchid in Pot 40 cm – Artificial Orchid Flowers for Indoor & Outdoor Decoration
Fake Orchid Plant,HOMESCAPES Large Artificial Pink Orchid in Pot 82 m Tall Lifelike Faux Orchid Plant In Grey Cement Pot Real Touch Silk Flowers and Green Leaves Phalaenopsis Orchid Flower for Indoor Decoration
Fake Orchid Plant,"Homescapes Large Burgundy Orchid with Artificial Silk Flowers in Grey Stone Pot, 57cm Tall with Lifelike Petals"
Fake Orchid Plant,HOMESCAPES Oriental Style White Orchid in a Contemporary Black Pot 70 cm – Artificial Flowers and Plants for Indoor Decoration
Fake Orchid Plant,Olrla White Artificial Phalaenopsis Orchid Plant in Pot for Table Office Home Wedding Party Garden Decor (White 1)
Fake Orchid Plant,RENATUHOM Artificial Orchid Flower Arrangements with Porcelain Vase Bonsai Artificial Flowers for Decoration Orchid Plant Fake White Flowers Home Bathroom Kitchen Table Centerpiece
Fake Orchid Plant,"RENATUHOM Artificial Orchid Flower Indoor, Decorative Purple Fake Flower Bonsai with Ceramic Vase, Artificial Plants Vivid Plant Arrangement Bonsai Party Home Decor"
Fake Orchid Plant,RENATUHOM Artificial Orchid Flower Phalaenopsis Fake Plant White Silk Orchid Artificial Flowers Bonsai for Home Table Indoor Decor with Vase
Fake Orchid Plant,RENATUHOM Artificial Orchid Flowers Fake White Flowers Orchid Plant With Vase Faux Flowers Decor Indoor Fake Plant Phalaenopsis Orchid Artificial Flower Arrangements Home Party Table Centerpiece
Fake Orchid Plant,RENATUHOM Artificial Orchid Purple Flower Orchid Flowers Artificial Plants Orchid Pot Flowers Silk Flower In Vase Kitchen Table Centerpiece Bathroom Ornament Home Decorative Flowers
Fake Orchid Plant,RENATUHOM Artificial Orchid Purple Flowers Fake Orchid Silk Phalaenopsis Artificial Flowers Arrangement Potted Orchid 12 Head with Two Stems Plant Home Table Party Decor
Fake Orchid Plant,RENATUHOM Pink Flowers Artificial Orchid Bonsai Fake Orchid Plant Phalaenopsis Orchid Artificial Flowers in Vase For Decoration Home Office Table Table Centerpiece
Fake Orchid Plant,"SHACOS Artificial Orchid White Artificial Phalaenopsis Orchid Plants Mini Orchid Silk Flower Arrangements Artificial Silk Flowers Perfect for Wedding, Decoration"
Fake Orchid Plant,U’Artlines Artificial Phalaenopsis Orchid Arrangement in Vase Decorative Artificial Orchid Flower Real Touch Home Office Party Decoration 38cm H
Fake Dracaena Plant,"4Ever Green Artificial Realistic Dracaena Dragon Plant Dracena Tree Fake Tall Plant for Home Room Indoor Outdoor Decoration in Plastic Pot, 155 cm"
Fake Dracaena Plant,"4Ever Green Artificial Realistic Dracaena Dragon Plant Dracena Tree Fake Tall Plant for Home Room Indoor Outdoor Decoration in Plastic Pot, 75 cm"
Fake Dracaena Plant,"artplants.de Artificial Bush of Dracaena in decorative pot, green, 7ft/215cm – Fake dracaena/Decorative plant"
Fake Dracaena Plant,"artplants.de Artificial Dracaena Fragrans (Cornstalk Dracaena), green, 4ft/120cm – Plastic Dracaena – Pool Decoration"
Fake Dracaena Plant,"artplants.de Artificial Dracaena JALA with 5 trunks, white-green, 4ft/120cm – Plastic Dracaena/Fake tree"
Fake Dracaena Plant,"artplants.de Artificial Dracaena marginata RADO, green-red, 6ft/180cm – Plastic dracaena/Decoration plant"
Fake Dracaena Plant,"artplants.de Artificial dracaena reflexa PHILOMENA, real trunks, green, 160cm – Faux dracaena/Imitation plant"
Fake Dracaena Plant,artplants.de Artificial Dracaena Reflexa/yellow-green / 3’11” / 120cm – Plastic Dracaena – Patio Decoration
Fake Dracaena Plant,"artplants.de Plastic Dracaena Fragrans Compact, 4ft/120cm – Artificial Dracaena – Office Decoration"
Fake Dracaena Plant,"artplants.de Plastic Dracaena Magenta, 4ft/120cm – Artificial Dracaena – Pool Decoration"
Fake Dracaena Plant,"artplants.de Set 2 x Plastic Dracaena Reflexa, yellow-green, 6ft/180cm – 2 pieces Artificial Dracaena – Patio Decoration"
Fake Dracaena Plant,"artplants.de Set 2 x Plastic Dracaena Surculosa, 9ft/270cm – 2 pieces Artificial Dracaena – Decorative Plant"
Fake Dracaena Plant,Dracaena Janet Craig | 2 Plants | houseplant | Height 70 cm | Pot 17 cm | Easy Maintenance
Fake Dracaena Plant,"Dracaena Lemon Lime | houseplant | Height 70 cm | Pot 17 cm | Easy Maintenance (1, Without Pot Cover)"
Fake Dracaena Plant,Dracaena Marginata | houseplant | Height 125 cm | Pot 24 cm | Easy Maintenance
Fake Dracaena Plant,"Dragon Tree | Dracaena fragrans Warneckii | 2 Plants | houseplant | Height 70 cm | Pot 17 cm | Easy Maintenance (2xWarneckii, Without Pot Cover)"
Fake Dracaena Plant,Flore Office Dracaena Artificial Buxus Reflex (160 cm) Top of the Range Dracaena Tropical Artificial Trees
Fake Dracaena Plant,Flore Office Dracaena Artificial Cordyline (60 cm) Top of the Range Dracaena Tropical Artificial Plants
Fake Dracaena Plant,"Gecko Artificial Dracaena Plant with 15 leaves, 80cm"
Fake Dracaena Plant,"Geko Artificial Dracaena Marginata tree, 120cm"
Fake Dracaena Plant,Indoor Plant -House or Office Plant -Dracaena marginata – Madagascar Dragon Tree 120cm
Fake Dracaena Plant,Indoor Plant -House or Office Plant -Dracaena marginata – Madagascar Dragon Tree Approx 80cm Tall
Fake Dracaena Plant,"Leaf Ceramic Drip Glazed Planter with Artificial Plant, green dracaena, 20cm, LEAF-7437"
Fake Dracaena Plant,"Leaf Design UK Artificial Dracaena Plant with Black Pot, Plastic, Variegated, 90cm"
Fake Dracaena Plant,"Leaf LEAF-7069 Design UK 75cm Artificial Dracaena Plant-Wide Trunk Triple Branch Large Black Plastic Pot, Variegated"
Fake Dracaena Plant,"Mica Decorations 1026439 Dracaena in Green – H110XD60 CM Rubber Plant Pot, Green, 60 x 60 x 110 cm"
Fake Dracaena Plant,"Mica Decorations 966130 Dracaena in Plastic Pot, Polyester, green, 77 x 77 x 100 cm"
Fake Dracaena Plant,"momoplant Artificial snake stripe Plant Faux Agave Fake Sansevieria Dracaena Potted Plants for Indoor&Outdoor Office Home room Decor 26″inchs 65CM (25.6“L * 13.7W Inchs, Green)"
Fake Dracaena Plant,Nearly Natural 4ft. Corn Stalk Dracaena Silk Plant Real Touch Green 125cm Artificial Floor Potted Plants Fake Plant for Interior Home Decoration
Fake Dracaena Plant,"Outsunny 110cm/3.6FT Artificial Dracaena Tree Decorative Plant 40 Leaves with Nursery Pot, Fake Tropical Tree for Indoor Outdoor Décor"
Fake Dracaena Plant,SKM Artificial Dracaena Plant with Pot 90 cm Green
Fake Dracaena Plant,Tidyard Artificial Dracaena Tree with Pot Outdoor&Indoors Plant Bonsai Display in Home 100 cm Green and Yellow
Fake Dracaena Plant,vidaXL Artificial Dracaena Plant with Pot 90cm Green Fake Lifelike Indoor
Fake Hydrangea Plant,"Brandless High Details Hydrangea Silk Flowers, Artificial Hydrangea Pack of 4 (Blue)"
Fake Hydrangea Plant,"CattleyaHQ 4 Heads Artificial Hydrangea Flowers,Elegant Hydrangea Bouquet,Simulation Plant Decoration for Party/Wedding/Home/Kitchen (White)"
Fake Hydrangea Plant,"Decpro 12Pcs Artificial Hydrangeas with Stems, 54 Petals Realistic Silk Hydrangea Fake Flowers for Wedding Home Office Party Café Arches Decoration, Centerpiece, DIY Floral Arrangements(Cream White)"
Fake Hydrangea Plant,"Decpro 12Pcs Artificial Hydrangeas with Stems, 54 Petals Realistic Silk Hydrangea Fake Flowers for Wedding Home Office Party Café Arches Decoration, Centerpiece, DIY Floral Arrangements(Light Purple)"
Fake Hydrangea Plant,"Decpro 6Pcs Artificial Hydrangeas, 6.6” Single Stem Hydrangea Silk Flowers for Bridal Wedding Bouquets, Home, Office, Hotel, Party Decoration, Centerpieces, Floral Arrangements (Purple)"
Fake Hydrangea Plant,"Famibay Hydrangea Fake Flowers 3 Pcs Artificial Flowers Bouquet Wedding Party Floral Décor Hydrangea Flower for Garden (3Pcs, Blue)"
Fake Hydrangea Plant,FiveSeasonStuff Real Touch Petals and Leaves Artificial Hydrangea Flowers Long Stem Floral Arrangement | for Wedding Bridal Party Home Décor DIY Floral Decoration | 2 Stems (White | Pale Green)
Fake Hydrangea Plant,Hydrangea Artificial Flowers 10pcs White Artificial Hydrangeas Flower Fake Flowers Real Touch Bridal Wedding Bouquet Faux Flowers for Home Party Hotel Office Christmas Thanksgiving Decor
Fake Hydrangea Plant,JUSTOYOU 3pcs Artificial Fake Cute Peony Silk Hydrangea Bouquet Grave Home Spring Beautiful Hydrangea Artificial Flower for Wedding Garden Decor(Blue)
Fake Hydrangea Plant,"SNAILGARDEN 30 Heads Artificial Hydrangea Flower,5 Packs Silk Realistic Hydrangea Bunch Bouquet with Greeting Card for Wedding Party Decoration Arrangement Gift(White,Blue,Green,Pink,Purple)"
Fake Hydrangea Plant,"Tifuly Artificial Hydrangea Flower, 5 PCS Realistic Single Long Stem Silk 6.6 Inch Flower Head Hydrangea Bouquets for Wedding, Home, Hotel, Party Decoration, Floral Arrangement(White)"
Fake Hydrangea Plant,"VINFUTUR 3 Bunches Artificial Peony Silk Flowers Fake Peony Silk Hydrangea Bouquet Bridal Bouquet for Wedding, Party, Home Decoration (White)"
Fake Hydrangea Plant,VINFUTUR 3Pcs Artificial Hydrangea Flower Fake Hydrangea Bouquets for Wedding Home Party Decoration (Orange Red)
Fake Hydrangea Plant,"XONOR 4 Packs Artificial Silk Hydrangea Fake Bridal Bridesmaid Flower Bouquet for Wedding Party Home Decoration, 10 heads, 36cm (Green)"
Fake Monstera Plant,"3 Pcs Artificial Tropical Palm Leaves Fake Monstera Tree Plant for Home Decorations 24.5 “, Green"
Fake Monstera Plant,AIVORIUY Artificial Palm Leaves with Stems Tropical Plant Large Faux Turtle Leaf Artificial Plants Monstera Leaves Safari Leaves for Home Hawaiian Luau Party Wedding Jungle Decorations Table Plant
Fake Monstera Plant,"Artificial Trees, 2 Set of 16 Inches Artificial Plants Faux Trees with Monstera and Palm Trees in Black Potted Plant for Home Office Indoor Outdoor Decoration, Monstera & Palm Trees, 2 Packs"
Fake Monstera Plant,DWANCE Artificial Potted Simulation Monstera Plant with Plastic anti-stone Faux Plant Turtle Back Leaf Fake Plastic Plant for Home Office Table Kitchen Shelf Bedroom Decoration Indoor Outdoor 40cm
Fake Monstera Plant,Falflor 2PCS Artificial Monstera Deliciosa Tree 120cm Faux Ficus Tree with Green Leaves Realistic Fake Tree Plant in Pot for Living Room Office Corner Front Door Home Decor
Fake Monstera Plant,FloralStem 100 cm Artificial Monstera Plant Multi Branch Tropical Potted
Fake Monstera Plant,FloralStem 100 cm Artificial Monstera Plant Tropical Potted
Fake Monstera Plant,"Leaf Artificial Monstera Plant, 120cm"
Fake Monstera Plant,Leaf LEAF-7068 Artificial Monstera Plant 60cm Black Pot
Fake Monstera Plant,"Leaf LEAF-7539 70cm Artificial Twisted Stem Plant, Monstera Vine"
Fake Monstera Plant,"Leaf LEAF-7540 90cm Artificial Twisted Stem Plant, Monstera Vine"
Fake Monstera Plant,"Leaf LEAF-7541 65cm Artificial Twisted Stem Plant, Monstera Vine"
Fake Monstera Plant,"Leaf LEAF-7542 60cm Artificial Twisted Stem Plant, Monstera Vine, 59cm"
Fake Monstera Plant,"Leaf LEAF-7543 120cm Artificial Twisted Stem Plant, Monstera Vine"
Fake Monstera Plant,"OTARTU Potted Fake Plants Artificial Monstera Deliciosa Tropical Plants with Pot, Home Office Desk,Book Shelf Decoration 25cm H"
Artificial Cheese Plant,"Outsunny 100cm/3.3FT Artificial Monstera Tree Decorative Cheese Plant 21 Leaves with Nursery Pot, Fake Tropical Palm Tree for Indoor Outdoor Décor"
Artificial Cheese Plant,"Outsunny 85cm/2.8FT Artificial Monstera Tree Decorative Cheese Plant 13 Leaves with Nursery Pot, Fake Tropical Palm Tree for Indoor Outdoor Décor"
Fake Monstera Plant,"Wakauto Faux Monstera Plant,Green Faux Monstera for Home Decor"
Artificial Cheese Plant,"whyshare 26cm Artificial Potted Cheeseplant Monstera, Variegated Ivy and Tropical Leaf Mini Plants Bedroom Outdoor Faux indoor plant set x3"
Artificial Cheese Plant,whyshare Faux Artificial Green Monstera Swiss Cheese Plant Split-Leaf Philodendron Home Office/Indoor and Outdoor in white Pot 36cm
Artificial Cheese Plant,"WhyShare Faux Artificial, Leaf Monstera Large Swiss Cheese Plant, Home office and Indoor/Outdoor Green in Cement Pot 50cm"
Artificial Cypress Tree,"35 Inch/2.95ft Artificial Topiary Spiral Cypress Trees Ceder Trees Boxwood Topiary Artificial outdoor Faux Topiary Spiral Cypress Trees Artificial Topiary Trees,Faux topiary Boxwood trees,Set of 2"
Artificial Cypress Tree,Artificial Cedar Pine Cypress Conifer Tree 90cm/3ft Potted Topiary Plant for Indoor Outdoor Decor
Artificial Cypress Tree,Artificial Cypress Topiary Spiral Tree – 1.2m (4ft) – UV resistant – Indoor/Outdoor Use
Artificial Cypress Tree,Artificial Cypress Topiary Spiral Tree – 1.5m (5ft) – UV resistant – Indoor/Outdoor Use
Artificial Cedar Trees,"artplants.de Artificial Cedar LEONARDO, green, 6ft/180cm – Artificial cypress tree/Fake tree"
Artificial Cedar Trees,Best Artificial Pair of 3ft 90cm Conifer Pine Cypress Cedar Trees
Artificial Cedar Trees,Best Artificial Potted Cedar Pine Cypress Conifer Tree (2ft)
Artificial Cypress Tree,Best Artificial Potted Cedar Pine Cypress Conifer Tree (4ft)
Artificial Cypress Tree,Flore Office Artificial Cypress Mini New (93 cm) Top of the Range Cypress Outdoor Artificial Trees
